{
  "$schema": "https://json-schema.org/draft/2020-12/schema",
  "$id": "https://aegis-platform.net/schemas/atx/v2/atx-technique.schema.json",
  "title": "ATX-1 Technique Definition",
  "description": "JSON Schema for ATX-1 v2.3 (AEGIS Threat Matrix) technique definitions. Each technique represents a specific failure mechanism in which an AI agent acts outside its governance boundaries. v2.3 removes the severity field in alignment with MITRE ATT&CK and ATLAS conventions, which leave contextual scoring to the consumer.",
  "schema_version": "2.3",
  "type": "object",
  "required": [
    "id",
    "name",
    "tactic",
    "description",
    "root_cause",
    "aegis_mitigation"
  ],
  "properties": {
    "id": {
      "type": "string",
      "pattern": "^T[0-9]{4,5}(\\.[0-9]{3})?$",
      "description": "Unique technique or sub-technique identifier. Techniques use format T#### or T##### (e.g., T1001, T10001). Sub-techniques use format T####.### or T#####.### (e.g., T9002.001, T10004.010)."
    },
    "name": {
      "type": "string",
      "description": "Human-readable technique name in verb-object format"
    },
    "tactic": {
      "type": "string",
      "pattern": "^TA[0-9]{3}$",
      "description": "Parent tactic identifier (e.g., TA001)"
    },
    "tactic_name": {
      "type": "string",
      "description": "Human-readable tactic name"
    },
    "description": {
      "type": "string",
      "description": "Full description of the technique and how it manifests"
    },
    "root_cause": {
      "type": "string",
      "description": "Structural root cause(s) from RC1-RC4 that enable this technique"
    },
    "agents_of_chaos_case": {
      "type": "array",
      "items": {
        "type": "integer"
      },
      "description": "Case study numbers from the Agents of Chaos research (Shapira et al., 2026)"
    },
    "owasp_mapping": {
      "type": "array",
      "items": {
        "type": "string"
      },
      "description": "OWASP Top 10 for LLM Applications category mappings (e.g., LLM01, LLM06)"
    },
    "aegis_mitigation": {
      "type": "object",
      "required": [
        "constitutional_article",
        "mechanism"
      ],
      "properties": {
        "constitutional_article": {
          "type": "string",
          "description": "AEGIS constitutional article that addresses this technique"
        },
        "agp_mechanism": {
          "type": "string",
          "description": "AEGIS Governance Protocol mechanism(s) that implement the mitigation"
        },
        "mechanism": {
          "type": "string",
          "description": "Description of how the mitigation works"
        }
      }
    },
    "v1_id": {
      "type": [
        "string",
        "null"
      ],
      "pattern": "^T[0-9]{4}$",
      "description": "The v1.0 technique ID this technique maps from (null for new techniques in v2.0)"
    },
    "parent_technique": {
      "type": "string",
      "pattern": "^T[0-9]{4,5}$",
      "description": "For sub-techniques only: the parent technique ID this sub-technique refines (e.g., T10004 for T10004.001)."
    },
    "sub_techniques": {
      "type": "array",
      "items": {
        "type": "string",
        "pattern": "^T[0-9]{4,5}\\.[0-9]{3}$"
      },
      "description": "For parent techniques only: list of sub-technique IDs that refine this technique."
    }
  },
  "additionalProperties": false
}
