[
  {
    "id": "T1001",
    "name": "Execute Non-Owner Instruction",
    "tactic": "TA001",
    "tactic_name": "Violate Authority Boundaries",
    "description": "The agent executes a destructive or high-impact action based on instructions from a user who does not hold owner-level authority. The agent treats the instruction as valid because no stakeholder model exists to distinguish authority levels.",
    "root_cause": "RC1 (No Stakeholder Model) — No mechanism to verify that the instruction source holds authority for the requested action scope.",
    "agents_of_chaos_case": [
      1
    ],
    "owasp_mapping": [
      "LLM06"
    ],
    "aegis_mitigation": {
      "constitutional_article": "Authority Delegation",
      "agp_mechanism": "AGP Stakeholder Model",
      "mechanism": "Formal principal hierarchy (owner > operator > user) with explicit delegation chains. Destructive actions require owner-level authorization verified against the stakeholder registry."
    },
    "v1_id": "T1001"
  },
  {
    "id": "T1002",
    "name": "Infer Implicit Authority",
    "tactic": "TA001",
    "tactic_name": "Violate Authority Boundaries",
    "description": "The agent accepts an instruction as authoritative based on implicit signals — such as the instruction appearing in a retrieved document, email body, or shared context — rather than explicit delegation from a verified principal.",
    "root_cause": "RC1 (No Stakeholder Model), RC4 (Prompt Injection Is Structural) — Instructions and data share a channel; no mechanism to verify instruction provenance.",
    "agents_of_chaos_case": [
      2
    ],
    "owasp_mapping": [
      "LLM01"
    ],
    "aegis_mitigation": {
      "constitutional_article": "Channel Separation",
      "agp_mechanism": "AGP Instruction Provenance",
      "mechanism": "All instructions tagged with verified source principal. Instructions and data processed in structurally distinct channels."
    },
    "v1_id": "T1002"
  },
  {
    "id": "T1003",
    "name": "Propagate Spoofed Authority at Scale",
    "tactic": "TA001",
    "tactic_name": "Violate Authority Boundaries",
    "description": "The agent distributes content (emails, messages, notifications) to a large number of recipients based on an authority claim that has not been verified. The spoofed authority may appear in a prompt, forwarded message, or injected context.",
    "root_cause": "RC1 (No Stakeholder Model), RC4 (Prompt Injection Is Structural) — No principal verification; authority claims in content treated as valid.",
    "agents_of_chaos_case": [
      11
    ],
    "owasp_mapping": [
      "LLM01",
      "LLM06"
    ],
    "aegis_mitigation": {
      "constitutional_article": "Proportionality Review",
      "agp_mechanism": "AGP Distribution Controls, AGP Rate Governance",
      "mechanism": "Mass actions require verified owner authorization with explicit recipient scope. Distribution volume triggers mandatory escalation."
    },
    "v1_id": "T1003"
  },
  {
    "id": "T2001",
    "name": "Expand Task Scope Autonomously",
    "tactic": "TA002",
    "tactic_name": "Exceed Operational Scope",
    "description": "The agent autonomously expands the scope of a delegated task beyond what was explicitly requested, including via tool invocation. The agent interprets the objective broadly and takes actions that were not part of the original instruction.",
    "root_cause": "RC2 (No Self-Model), RC3 (No Private Deliberation Surface) — Agent cannot evaluate whether expanded scope is within delegated authority; no deliberation surface to assess scope boundaries.",
    "agents_of_chaos_case": [
      3
    ],
    "owasp_mapping": [
      "LLM06"
    ],
    "aegis_mitigation": {
      "constitutional_article": "Scope Boundaries",
      "agp_mechanism": "AGP Task Scope Enforcement",
      "mechanism": "Each delegated task carries explicit scope boundaries. Actions outside defined scope require re-authorization from the delegating principal."
    },
    "v1_id": "T3001"
  },
  {
    "id": "T2002",
    "name": "Perform Unvalidated Bulk Operations",
    "tactic": "TA002",
    "tactic_name": "Exceed Operational Scope",
    "description": "The agent performs bulk operations (mass edits, batch deletions, large-scale API calls) without validating that the scope of the operation matches the intent of the instruction, including via tool invocation.",
    "root_cause": "RC2 (No Self-Model), RC3 (No Private Deliberation Surface) — Agent cannot assess aggregate impact of bulk actions; no proportionality check against instruction intent.",
    "agents_of_chaos_case": [
      1
    ],
    "owasp_mapping": [
      "LLM06"
    ],
    "aegis_mitigation": {
      "constitutional_article": "Proportionality Review",
      "agp_mechanism": "AGP Bulk Operation Gate",
      "mechanism": "Bulk operations require explicit scope confirmation and aggregate impact assessment before execution. Volume thresholds trigger mandatory escalation."
    },
    "v1_id": "T2003"
  },
  {
    "id": "T2003",
    "name": "Obscure Objective Through Delegation",
    "tactic": "TA002",
    "tactic_name": "Exceed Operational Scope",
    "description": "Harmful intent is decomposed across multiple delegated steps — including across multiple agents where no single agent has full visibility of the objective — such that no individual action appears unsafe.",
    "root_cause": "RC2 (No Self-Model), RC3 (No Private Deliberation Surface) — Agent cannot evaluate aggregate intent across delegation chains; no mechanism to detect composition attacks.",
    "agents_of_chaos_case": [],
    "owasp_mapping": [
      "LLM01",
      "LLM07"
    ],
    "aegis_mitigation": {
      "constitutional_article": "Delegation Transparency",
      "agp_mechanism": "AGP Delegation Chain Audit, AGP Composition Analysis",
      "mechanism": "All delegation chains must be traceable end-to-end. Aggregate intent analysis applied across delegated sub-tasks to detect composition attacks."
    },
    "v1_id": null
  },
  {
    "id": "T2004",
    "name": "Exploit Tool-Chain Composition",
    "tactic": "TA002",
    "tactic_name": "Exceed Operational Scope",
    "description": "The agent chains multiple tool calls or intermediate steps such that each step appears valid, but the aggregate effect bypasses policy or authorization constraints.",
    "root_cause": "RC2 (No Self-Model), RC3 (No Private Deliberation Surface) — Agent cannot evaluate aggregate policy impact of chained tool calls; no compositional policy enforcement.",
    "agents_of_chaos_case": [],
    "owasp_mapping": [
      "LLM07"
    ],
    "aegis_mitigation": {
      "constitutional_article": "Bounded Capability",
      "agp_mechanism": "AGP Tool Chain Validation",
      "mechanism": "Tool call sequences are evaluated as aggregate operations. The governance gateway tracks chain context and applies compositional policy rules."
    },
    "v1_id": null
  },
  {
    "id": "T3001",
    "name": "Perform Irreversible Destructive Action",
    "tactic": "TA003",
    "tactic_name": "Compromise System Integrity",
    "description": "The agent selects an irreversible action (permanent deletion, irrecoverable modification) through direct or tool-mediated system interaction when a reversible alternative (archival, soft-delete, flagging) would satisfy the objective.",
    "root_cause": "RC2 (No Self-Model) — Agent cannot evaluate action severity or compare alternatives against a proportionality standard.",
    "agents_of_chaos_case": [
      1
    ],
    "owasp_mapping": [
      "LLM06"
    ],
    "aegis_mitigation": {
      "constitutional_article": "Least-Destructive Means",
      "agp_mechanism": "AGP Proportionality Gate",
      "mechanism": "Irreversible actions require explicit confirmation and must demonstrate that no reversible alternative satisfies the objective."
    },
    "v1_id": "T2001"
  },
  {
    "id": "T3002",
    "name": "Trigger Cascading System Changes",
    "tactic": "TA003",
    "tactic_name": "Compromise System Integrity",
    "description": "The agent initiates an action through direct or tool-mediated system interaction that triggers a chain of cascading changes across interconnected systems, where downstream effects were not anticipated or authorized.",
    "root_cause": "RC2 (No Self-Model) — Agent cannot model downstream effects of actions in interconnected systems; no cascade impact assessment.",
    "agents_of_chaos_case": [
      7
    ],
    "owasp_mapping": [],
    "aegis_mitigation": {
      "constitutional_article": "Impact Assessment",
      "agp_mechanism": "AGP Cascade Analysis, AGP Interaction Intensity Limits",
      "mechanism": "Actions with cross-system dependencies require cascade impact analysis. Downstream effect scope must be bounded and authorized."
    },
    "v1_id": "T2002"
  },
  {
    "id": "T4001",
    "name": "Exfiltrate Context-Scoped Data",
    "tactic": "TA004",
    "tactic_name": "Expose or Exfiltrate Information",
    "description": "The agent exports or discloses data from the current context (conversation, session, task) to an unauthorized recipient, whether through direct exfiltration, indirect request compliance, or tool-mediated data transfer.",
    "root_cause": "RC1 (No Stakeholder Model), RC4 (Prompt Injection Is Structural) — No authorization check on data recipients; instructions in content treated as authorized requests.",
    "agents_of_chaos_case": [
      2
    ],
    "owasp_mapping": [
      "LLM02"
    ],
    "aegis_mitigation": {
      "constitutional_article": "Information Boundaries",
      "agp_mechanism": "AGP Data Classification, AGP Disclosure Gate",
      "mechanism": "All data tagged with sensitivity level and authorized recipient scope. Bulk data exports require explicit owner authorization verified against principal registry."
    },
    "v1_id": "T4001"
  },
  {
    "id": "T4002",
    "name": "Leak Cross-Session or Persistent Data",
    "tactic": "TA004",